Running "module reset". Resetting modules to system default. The following $MODULEPATH directories have been removed: None
Starting evaluation for predicted_diagnoses_claude-opus-4-5-20251101_medical_literature_only_20260126_212746.json...
  0%|          | 0/135 [00:00<?, ?it/s]  1%|          | 1/135 [00:21<48:35, 21.76s/it]  1%|▏         | 2/135 [00:46<52:42, 23.78s/it]  2%|▏         | 3/135 [01:16<57:45, 26.26s/it]  3%|▎         | 4/135 [01:34<50:17, 23.04s/it]  4%|▎         | 5/135 [01:52<46:16, 21.36s/it]  4%|▍         | 6/135 [02:06<40:48, 18.98s/it]  5%|▌         | 7/135 [02:43<52:56, 24.82s/it]  6%|▌         | 8/135 [04:08<1:32:39, 43.78s/it]  7%|▋         | 9/135 [04:48<1:29:45, 42.75s/it]  7%|▋         | 10/135 [05:08<1:14:33, 35.79s/it]  8%|▊         | 11/135 [05:29<1:04:06, 31.02s/it]  9%|▉         | 12/135 [05:58<1:02:49, 30.64s/it] 10%|▉         | 13/135 [06:22<58:05, 28.57s/it]   10%|█         | 14/135 [06:33<46:54, 23.26s/it] 11%|█         | 15/135 [07:00<48:38, 24.32s/it] 12%|█▏        | 16/135 [07:20<45:37, 23.00s/it] 13%|█▎        | 17/135 [07:54<51:43, 26.30s/it] 13%|█▎        | 18/135 [08:32<58:06, 29.80s/it] 14%|█▍        | 19/135 [08:55<53:50, 27.85s/it] 15%|█▍        | 20/135 [09:15<48:39, 25.38s/it] 16%|█▌        | 21/135 [09:52<54:44, 28.81s/it] 16%|█▋        | 22/135 [10:25<56:39, 30.09s/it] 17%|█▋        | 23/135 [10:39<47:27, 25.42s/it] 18%|█▊        | 24/135 [10:58<43:21, 23.43s/it] 19%|█▊        | 25/135 [11:13<38:10, 20.82s/it] 19%|█▉        | 26/135 [11:25<33:23, 18.38s/it] 20%|██        | 27/135 [11:49<35:40, 19.82s/it] 21%|██        | 28/135 [12:22<42:48, 24.00s/it] 21%|██▏       | 29/135 [12:59<48:53, 27.67s/it] 22%|██▏       | 30/135 [13:35<53:09, 30.38s/it] 23%|██▎       | 31/135 [13:58<48:51, 28.18s/it] 24%|██▎       | 32/135 [14:18<44:07, 25.71s/it] 24%|██▍       | 33/135 [14:45<44:03, 25.92s/it] 25%|██▌       | 34/135 [15:02<39:12, 23.29s/it] 26%|██▌       | 35/135 [15:26<39:04, 23.45s/it] 27%|██▋       | 36/135 [16:05<46:26, 28.15s/it] 27%|██▋       | 37/135 [16:23<41:09, 25.20s/it] 28%|██▊       | 38/135 [16:37<35:10, 21.75s/it] 29%|██▉       | 39/135 [17:02<36:36, 22.88s/it] 30%|██▉       | 40/135 [17:49<47:33, 30.04s/it] 30%|███       | 41/135 [18:15<45:23, 28.97s/it] 31%|███       | 42/135 [19:19<1:00:45, 39.20s/it] 32%|███▏      | 43/135 [19:50<56:36, 36.92s/it]   33%|███▎      | 44/135 [20:08<47:22, 31.24s/it] 33%|███▎      | 45/135 [20:33<43:53, 29.26s/it] 34%|███▍      | 46/135 [20:58<41:26, 27.94s/it] 35%|███▍      | 47/135 [21:32<43:42, 29.80s/it] 36%|███▌      | 48/135 [22:20<51:09, 35.28s/it] 36%|███▋      | 49/135 [22:44<45:40, 31.87s/it] 37%|███▋      | 50/135 [23:00<38:34, 27.22s/it] 38%|███▊      | 51/135 [23:21<35:17, 25.21s/it] 39%|███▊      | 52/135 [24:16<47:24, 34.27s/it] 39%|███▉      | 53/135 [24:41<42:52, 31.37s/it] 40%|████      | 54/135 [25:05<39:19, 29.13s/it] 41%|████      | 55/135 [25:48<44:34, 33.43s/it] 41%|████▏     | 56/135 [26:24<44:50, 34.06s/it] 42%|████▏     | 57/135 [27:06<47:21, 36.43s/it] 43%|████▎     | 58/135 [27:47<48:40, 37.93s/it] 44%|████▎     | 59/135 [28:22<47:05, 37.18s/it] 44%|████▍     | 60/135 [28:42<39:53, 31.91s/it] 45%|████▌     | 61/135 [28:58<33:20, 27.03s/it] 46%|████▌     | 62/135 [29:22<31:46, 26.12s/it] 47%|████▋     | 63/135 [29:38<27:48, 23.17s/it] 47%|████▋     | 64/135 [30:04<28:20, 23.95s/it] 48%|████▊     | 65/135 [30:38<31:24, 26.92s/it] 49%|████▉     | 66/135 [31:31<40:02, 34.82s/it] 50%|████▉     | 67/135 [31:51<34:25, 30.38s/it] 50%|█████     | 68/135 [32:11<30:38, 27.44s/it] 51%|█████     | 69/135 [32:37<29:32, 26.86s/it] 52%|█████▏    | 70/135 [32:48<24:07, 22.28s/it] 53%|█████▎    | 71/135 [33:50<36:10, 33.91s/it] 53%|█████▎    | 72/135 [34:27<36:44, 34.99s/it] 54%|█████▍    | 73/135 [34:36<28:01, 27.13s/it] 55%|█████▍    | 74/135 [35:16<31:32, 31.03s/it] 56%|█████▌    | 75/135 [35:55<33:18, 33.30s/it] 56%|█████▋    | 76/135 [36:16<29:18, 29.81s/it] 57%|█████▋    | 77/135 [36:29<23:59, 24.81s/it] 58%|█████▊    | 78/135 [37:14<29:19, 30.87s/it] 59%|█████▊    | 79/135 [37:54<31:19, 33.56s/it] 59%|█████▉    | 80/135 [38:13<26:43, 29.15s/it] 60%|██████    | 81/135 [38:48<27:45, 30.84s/it] 61%|██████    | 82/135 [39:05<23:44, 26.87s/it] 61%|██████▏   | 83/135 [39:16<19:04, 22.02s/it] 62%|██████▏   | 84/135 [39:42<19:37, 23.08s/it] 63%|██████▎   | 85/135 [39:59<17:41, 21.23s/it] 64%|██████▎   | 86/135 [40:48<24:08, 29.56s/it] 64%|██████▍   | 87/135 [41:16<23:26, 29.30s/it] 65%|██████▌   | 88/135 [42:08<28:15, 36.07s/it] 66%|██████▌   | 89/135 [42:21<22:21, 29.15s/it] 67%|██████▋   | 90/135 [43:04<24:54, 33.20s/it] 67%|██████▋   | 91/135 [43:55<28:21, 38.68s/it] 68%|██████▊   | 92/135 [44:14<23:22, 32.62s/it] 69%|██████▉   | 93/135 [44:40<21:30, 30.72s/it] 70%|██████▉   | 94/135 [44:58<18:16, 26.74s/it] 70%|███████   | 95/135 [45:20<16:57, 25.45s/it] 71%|███████   | 96/135 [45:49<17:17, 26.61s/it] 72%|███████▏  | 97/135 [46:08<15:24, 24.33s/it] 73%|███████▎  | 98/135 [46:34<15:18, 24.81s/it] 73%|███████▎  | 99/135 [47:15<17:49, 29.72s/it] 74%|███████▍  | 100/135 [47:28<14:20, 24.59s/it] 75%|███████▍  | 101/135 [47:41<11:59, 21.16s/it] 76%|███████▌  | 102/135 [48:18<14:12, 25.82s/it] 76%|███████▋  | 103/135 [48:35<12:21, 23.16s/it] 77%|███████▋  | 104/135 [49:04<12:54, 24.99s/it] 78%|███████▊  | 105/135 [49:18<10:50, 21.70s/it] 79%|███████▊  | 106/135 [50:05<14:07, 29.22s/it] 79%|███████▉  | 107/135 [50:30<13:00, 27.86s/it] 80%|████████  | 108/135 [51:01<13:01, 28.96s/it] 81%|████████  | 109/135 [51:18<10:54, 25.19s/it] 81%|████████▏ | 110/135 [52:00<12:43, 30.53s/it] 82%|████████▏ | 111/135 [52:32<12:22, 30.94s/it] 83%|████████▎ | 112/135 [52:47<10:00, 26.09s/it] 84%|████████▎ | 113/135 [53:56<14:13, 38.79s/it] 84%|████████▍ | 114/135 [54:36<13:47, 39.39s/it] 85%|████████▌ | 115/135 [55:18<13:22, 40.14s/it] 86%|████████▌ | 116/135 [55:35<10:27, 33.04s/it] 87%|████████▋ | 117/135 [56:10<10:05, 33.61s/it] 87%|████████▋ | 118/135 [56:26<08:00, 28.28s/it] 88%|████████▊ | 119/135 [57:01<08:05, 30.33s/it] 89%|████████▉ | 120/135 [57:34<07:49, 31.29s/it] 90%|████████▉ | 121/135 [57:53<06:25, 27.51s/it] 90%|█████████ | 122/135 [58:31<06:37, 30.56s/it] 91%|█████████ | 123/135 [59:03<06:14, 31.19s/it] 92%|█████████▏| 124/135 [59:25<05:11, 28.32s/it] 93%|█████████▎| 125/135 [59:57<04:54, 29.44s/it] 93%|█████████▎| 126/135 [1:00:09<03:37, 24.16s/it] 94%|█████████▍| 127/135 [1:00:24<02:50, 21.37s/it] 95%|█████████▍| 128/135 [1:00:35<02:09, 18.51s/it] 96%|█████████▌| 129/135 [1:00:45<01:34, 15.70s/it] 96%|█████████▋| 130/135 [1:01:10<01:33, 18.60s/it] 97%|█████████▋| 131/135 [1:01:41<01:29, 22.42s/it] 98%|█████████▊| 132/135 [1:01:58<01:02, 20.82s/it] 99%|█████████▊| 133/135 [1:02:35<00:51, 25.67s/it] 99%|█████████▉| 134/135 [1:02:49<00:21, 21.93s/it]100%|██████████| 135/135 [1:04:04<00:00, 37.93s/it]100%|██████████| 135/135 [1:04:04<00:00, 28.48s/it]
Done! Made 873 calls to LLM.

=== FINAL DIAGNOSTIC PERFORMANCE (Mean Scores) ===

Saved performance summary to '../../../../results/top_5_accuracy/accuracy_metrics/memorization_experiment/summarized_resultspredicted_diagnoses_claude-opus-4-5-20251101_medical_literature_only_20260126_212746.json_diagnostic_performance_summary.csv'

Total Cases Completely Missed: 32
Example Miss:
diagnosis             Anorexia nervosa with focal cortical dysplasia
model_diagnosis    1. Anorexia Nervosa, Restricting Type - F50.01...
Name: 1, dtype: object

Saved detailed results to '../../../../results/top_5_accuracy/accuracy_metrics/memorization_experiment/detailed_results/predicted_diagnoses_claude-opus-4-5-20251101_medical_literature_only_20260126_212746.json_diagnostic_evaluation_results_detailed.csv'
Starting evaluation for predicted_diagnoses_gemini-3-pro-preview_medical_literature_only_20260126_163757.json...
  0%|          | 0/135 [00:00<?, ?it/s]  1%|          | 1/135 [00:19<43:04, 19.29s/it]  1%|▏         | 2/135 [00:36<40:12, 18.14s/it]  2%|▏         | 3/135 [01:01<46:11, 20.99s/it]  3%|▎         | 4/135 [01:18<42:59, 19.69s/it]  4%|▎         | 5/135 [01:37<42:14, 19.50s/it]  4%|▍         | 6/135 [01:55<40:34, 18.87s/it]  5%|▌         | 7/135 [02:45<1:01:45, 28.95s/it]  6%|▌         | 8/135 [03:59<1:31:48, 43.37s/it]  7%|▋         | 9/135 [04:35<1:26:12, 41.05s/it]  7%|▋         | 10/135 [05:02<1:16:33, 36.75s/it]  8%|▊         | 11/135 [05:22<1:05:06, 31.51s/it]  9%|▉         | 12/135 [05:48<1:01:35, 30.04s/it] 10%|▉         | 13/135 [06:15<59:04, 29.05s/it]   10%|█         | 14/135 [06:29<49:37, 24.61s/it] 11%|█         | 15/135 [06:55<49:50, 24.92s/it] 12%|█▏        | 16/135 [07:11<44:06, 22.24s/it] 13%|█▎        | 17/135 [07:51<54:13, 27.57s/it] 13%|█▎        | 18/135 [08:24<57:08, 29.30s/it] 14%|█▍        | 19/135 [08:52<55:40, 28.80s/it] 15%|█▍        | 20/135 [09:15<52:00, 27.14s/it] 16%|█▌        | 21/135 [09:42<51:33, 27.14s/it] 16%|█▋        | 22/135 [10:14<53:21, 28.33s/it] 17%|█▋        | 23/135 [10:34<48:13, 25.84s/it] 18%|█▊        | 24/135 [11:03<50:02, 27.05s/it] 19%|█▊        | 25/135 [11:24<46:00, 25.09s/it] 19%|█▉        | 26/135 [11:39<39:59, 22.01s/it] 20%|██        | 27/135 [12:11<45:14, 25.14s/it] 21%|██        | 28/135 [12:50<51:52, 29.09s/it] 21%|██▏       | 29/135 [13:22<53:06, 30.06s/it] 22%|██▏       | 30/135 [13:43<47:42, 27.26s/it] 23%|██▎       | 31/135 [14:09<46:34, 26.87s/it] 24%|██▎       | 32/135 [14:38<47:26, 27.64s/it] 24%|██▍       | 33/135 [15:04<46:06, 27.12s/it] 25%|██▌       | 34/135 [15:18<39:12, 23.29s/it] 26%|██▌       | 35/135 [15:47<41:45, 25.06s/it] 27%|██▋       | 36/135 [16:36<52:54, 32.07s/it] 27%|██▋       | 37/135 [17:06<51:29, 31.52s/it] 28%|██▊       | 38/135 [17:20<42:24, 26.24s/it] 29%|██▉       | 39/135 [17:47<42:08, 26.34s/it] 30%|██▉       | 40/135 [18:35<52:10, 32.95s/it] 30%|███       | 41/135 [18:58<46:44, 29.84s/it] 31%|███       | 42/135 [19:59<1:00:43, 39.18s/it] 32%|███▏      | 43/135 [20:24<53:40, 35.01s/it]   33%|███▎      | 44/135 [20:49<48:25, 31.93s/it] 33%|███▎      | 45/135 [21:30<52:15, 34.84s/it] 34%|███▍      | 46/135 [21:50<45:06, 30.41s/it] 35%|███▍      | 47/135 [22:22<45:05, 30.74s/it] 36%|███▌      | 48/135 [23:29<1:00:16, 41.57s/it] 36%|███▋      | 49/135 [23:57<54:00, 37.68s/it]   37%|███▋      | 50/135 [24:27<50:01, 35.31s/it] 38%|███▊      | 51/135 [24:44<41:50, 29.89s/it] 39%|███▊      | 52/135 [25:29<47:41, 34.48s/it] 39%|███▉      | 53/135 [25:52<42:13, 30.89s/it] 40%|████      | 54/135 [26:14<37:58, 28.13s/it] 41%|████      | 55/135 [26:42<37:42, 28.29s/it] 41%|████▏     | 56/135 [27:08<36:20, 27.60s/it] 42%|████▏     | 57/135 [27:30<33:29, 25.77s/it] 43%|████▎     | 58/135 [28:01<35:20, 27.54s/it] 44%|████▎     | 59/135 [28:18<30:52, 24.38s/it] 44%|████▍     | 60/135 [28:36<27:45, 22.21s/it] 45%|████▌     | 61/135 [28:48<23:41, 19.20s/it] 46%|████▌     | 62/135 [29:05<22:35, 18.57s/it] 47%|████▋     | 63/135 [29:19<20:33, 17.13s/it] 47%|████▋     | 64/135 [29:40<21:48, 18.43s/it] 48%|████▊     | 65/135 [30:35<34:10, 29.30s/it] 49%|████▉     | 66/135 [31:20<39:11, 34.07s/it] 50%|████▉     | 67/135 [31:51<37:29, 33.08s/it] 50%|█████     | 68/135 [32:14<33:48, 30.28s/it] 51%|█████     | 69/135 [32:40<31:36, 28.74s/it] 52%|█████▏    | 70/135 [32:53<26:07, 24.11s/it] 53%|█████▎    | 71/135 [33:54<37:36, 35.26s/it] 53%|█████▎    | 72/135 [34:26<36:02, 34.33s/it] 54%|█████▍    | 73/135 [34:38<28:30, 27.60s/it] 55%|█████▍    | 74/135 [35:19<31:56, 31.42s/it] 56%|█████▌    | 75/135 [36:02<35:04, 35.08s/it] 56%|█████▋    | 76/135 [36:28<31:47, 32.34s/it] 57%|█████▋    | 77/135 [36:55<29:39, 30.68s/it] 58%|█████▊    | 78/135 [37:41<33:24, 35.17s/it] 59%|█████▊    | 79/135 [38:22<34:25, 36.89s/it] 59%|█████▉    | 80/135 [38:41<29:07, 31.77s/it] 60%|██████    | 81/135 [39:18<29:52, 33.20s/it] 61%|██████    | 82/135 [39:39<26:00, 29.45s/it] 61%|██████▏   | 83/135 [39:51<21:01, 24.25s/it] 62%|██████▏   | 84/135 [40:16<20:57, 24.66s/it] 63%|██████▎   | 85/135 [40:34<18:43, 22.47s/it] 64%|██████▎   | 86/135 [41:10<21:49, 26.72s/it] 64%|██████▍   | 87/135 [41:43<22:47, 28.49s/it] 65%|██████▌   | 88/135 [42:37<28:19, 36.17s/it] 66%|██████▌   | 89/135 [42:50<22:23, 29.21s/it] 67%|██████▋   | 90/135 [43:20<22:05, 29.45s/it] 67%|██████▋   | 91/135 [44:08<25:46, 35.14s/it] 68%|██████▊   | 92/135 [44:24<20:53, 29.15s/it] 69%|██████▉   | 93/135 [44:58<21:31, 30.75s/it] 70%|██████▉   | 94/135 [45:39<23:08, 33.86s/it] 70%|███████   | 95/135 [46:08<21:28, 32.21s/it] 71%|███████   | 96/135 [46:47<22:18, 34.33s/it] 72%|███████▏  | 97/135 [47:04<18:29, 29.19s/it] 73%|███████▎  | 98/135 [47:34<18:12, 29.54s/it] 73%|███████▎  | 99/135 [48:07<18:13, 30.38s/it] 74%|███████▍  | 100/135 [48:27<16:00, 27.45s/it] 75%|███████▍  | 101/135 [48:41<13:12, 23.30s/it] 76%|███████▌  | 102/135 [49:18<15:01, 27.33s/it] 76%|███████▋  | 103/135 [49:37<13:16, 24.88s/it] 77%|███████▋  | 104/135 [50:11<14:20, 27.74s/it] 78%|███████▊  | 105/135 [50:28<12:10, 24.35s/it] 79%|███████▊  | 106/135 [51:20<15:51, 32.81s/it] 79%|███████▉  | 107/135 [51:41<13:38, 29.22s/it] 80%|████████  | 108/135 [52:17<14:00, 31.14s/it] 81%|████████  | 109/135 [52:32<11:26, 26.42s/it] 81%|████████▏ | 110/135 [53:14<12:54, 30.99s/it] 82%|████████▏ | 111/135 [54:16<16:05, 40.24s/it] 83%|████████▎ | 112/135 [54:35<13:05, 34.13s/it] 84%|████████▎ | 113/135 [55:33<15:03, 41.06s/it] 84%|████████▍ | 114/135 [56:25<15:30, 44.31s/it] 85%|████████▌ | 115/135 [57:33<17:09, 51.49s/it] 86%|████████▌ | 116/135 [57:46<12:41, 40.10s/it] 87%|████████▋ | 117/135 [58:17<11:13, 37.41s/it] 87%|████████▋ | 118/135 [58:36<09:01, 31.86s/it] 88%|████████▊ | 119/135 [59:11<08:44, 32.76s/it] 89%|████████▉ | 120/135 [59:46<08:20, 33.34s/it] 90%|████████▉ | 121/135 [1:00:12<07:16, 31.17s/it] 90%|█████████ | 122/135 [1:00:56<07:35, 35.00s/it] 91%|█████████ | 123/135 [1:01:27<06:46, 33.90s/it] 92%|█████████▏| 124/135 [1:01:41<05:06, 27.91s/it] 93%|█████████▎| 125/135 [1:02:08<04:36, 27.67s/it] 93%|█████████▎| 126/135 [1:02:21<03:28, 23.13s/it] 94%|█████████▍| 127/135 [1:02:33<02:39, 19.94s/it] 95%|█████████▍| 128/135 [1:02:47<02:05, 17.93s/it] 96%|█████████▌| 129/135 [1:02:58<01:35, 15.90s/it] 96%|█████████▋| 130/135 [1:03:26<01:37, 19.52s/it] 97%|█████████▋| 131/135 [1:04:12<01:49, 27.44s/it] 98%|█████████▊| 132/135 [1:04:20<01:05, 21.82s/it] 99%|█████████▊| 133/135 [1:04:58<00:52, 26.42s/it] 99%|█████████▉| 134/135 [1:05:17<00:24, 24.24s/it]100%|██████████| 135/135 [1:05:27<00:00, 20.04s/it]100%|██████████| 135/135 [1:05:27<00:00, 29.09s/it]
Done! Made 909 calls to LLM.

=== FINAL DIAGNOSTIC PERFORMANCE (Mean Scores) ===

Saved performance summary to '../../../../results/top_5_accuracy/accuracy_metrics/memorization_experiment/summarized_resultspredicted_diagnoses_gemini-3-pro-preview_medical_literature_only_20260126_163757.json_diagnostic_performance_summary.csv'

Total Cases Completely Missed: 40
Example Miss:
diagnosis             Anorexia nervosa with focal cortical dysplasia
model_diagnosis    1. Anorexia nervosa, restricting type - ICD-10...
Name: 1, dtype: object

Saved detailed results to '../../../../results/top_5_accuracy/accuracy_metrics/memorization_experiment/detailed_results/predicted_diagnoses_gemini-3-pro-preview_medical_literature_only_20260126_163757.json_diagnostic_evaluation_results_detailed.csv'
Starting evaluation for predicted_diagnoses_deepseek-reasoner_fictitious_only_20260126_142132.json...
  0%|          | 0/61 [00:00<?, ?it/s]  2%|▏         | 1/61 [00:17<17:21, 17.36s/it]  3%|▎         | 2/61 [00:52<27:10, 27.64s/it]  5%|▍         | 3/61 [01:20<26:55, 27.86s/it]  7%|▋         | 4/61 [01:37<22:28, 23.65s/it]  8%|▊         | 5/61 [02:01<22:17, 23.88s/it] 10%|▉         | 6/61 [02:56<31:28, 34.33s/it] 11%|█▏        | 7/61 [03:37<32:52, 36.52s/it] 13%|█▎        | 8/61 [04:49<42:10, 47.75s/it] 15%|█▍        | 9/61 [05:12<34:47, 40.14s/it] 16%|█▋        | 10/61 [05:35<29:42, 34.94s/it] 18%|█▊        | 11/61 [06:04<27:33, 33.07s/it] 20%|█▉        | 12/61 [06:30<25:12, 30.87s/it] 21%|██▏       | 13/61 [07:14<27:51, 34.83s/it] 23%|██▎       | 14/61 [07:33<23:30, 30.00s/it] 25%|██▍       | 15/61 [07:55<21:11, 27.63s/it] 26%|██▌       | 16/61 [09:04<30:07, 40.16s/it] 28%|██▊       | 17/61 [09:49<30:24, 41.48s/it] 30%|██▉       | 18/61 [10:35<30:48, 42.99s/it] 31%|███       | 19/61 [10:59<26:07, 37.33s/it] 33%|███▎      | 20/61 [12:17<33:43, 49.36s/it] 34%|███▍      | 21/61 [13:04<32:26, 48.67s/it] 36%|███▌      | 22/61 [14:08<34:35, 53.21s/it] 38%|███▊      | 23/61 [14:47<31:07, 49.13s/it] 39%|███▉      | 24/61 [15:23<27:43, 44.96s/it] 41%|████      | 25/61 [15:58<25:12, 42.01s/it] 85%|████████▌ | 52/61 [16:15<00:35,  3.95s/it] 87%|████████▋ | 53/61 [16:37<00:38,  4.77s/it] 89%|████████▊ | 54/61 [17:01<00:41,  5.94s/it] 90%|█████████ | 55/61 [17:49<00:56,  9.39s/it] 92%|█████████▏| 56/61 [18:15<00:55, 11.15s/it] 93%|█████████▎| 57/61 [18:33<00:47, 11.98s/it] 95%|█████████▌| 58/61 [18:52<00:39, 13.17s/it] 97%|█████████▋| 59/61 [19:10<00:27, 13.98s/it] 98%|█████████▊| 60/61 [19:29<00:14, 14.98s/it]100%|██████████| 61/61 [19:59<00:00, 18.43s/it]100%|██████████| 61/61 [19:59<00:00, 19.66s/it]
Done! Made 298 calls to LLM.

=== FINAL DIAGNOSTIC PERFORMANCE (Mean Scores) ===

Saved performance summary to '../../../../results/top_5_accuracy/accuracy_metrics/memorization_experiment/summarized_resultspredicted_diagnoses_deepseek-reasoner_fictitious_only_20260126_142132.json_diagnostic_performance_summary.csv'

Total Cases Completely Missed: 8
Example Miss:
diagnosis          Bipolar disorder, most recent episode manic, i...
model_diagnosis    1. Bipolar and related disorder due to multipl...
Name: 1, dtype: object

Saved detailed results to '../../../../results/top_5_accuracy/accuracy_metrics/memorization_experiment/detailed_results/predicted_diagnoses_deepseek-reasoner_fictitious_only_20260126_142132.json_diagnostic_evaluation_results_detailed.csv'
Starting evaluation for predicted_diagnoses_deepseek-reasoner_medical_literature_only_20260126_145408.json...
  0%|          | 0/135 [00:00<?, ?it/s]  1%|          | 1/135 [00:25<56:01, 25.08s/it]  1%|▏         | 2/135 [00:45<48:53, 22.06s/it]  2%|▏         | 3/135 [01:14<56:00, 25.46s/it]  3%|▎         | 4/135 [01:31<48:38, 22.28s/it]  4%|▎         | 5/135 [01:49<44:56, 20.74s/it]  4%|▍         | 6/135 [02:10<44:42, 20.80s/it]  5%|▌         | 7/135 [02:36<47:39, 22.34s/it]  6%|▌         | 8/135 [03:23<1:03:53, 30.18s/it]  7%|▋         | 9/135 [04:27<1:25:47, 40.85s/it]  7%|▋         | 10/135 [04:48<1:12:00, 34.57s/it]  8%|▊         | 11/135 [05:12<1:04:48, 31.36s/it]  9%|▉         | 12/135 [05:32<57:09, 27.88s/it]   10%|▉         | 13/135 [05:54<53:16, 26.20s/it] 10%|█         | 14/135 [06:09<46:13, 22.92s/it] 11%|█         | 15/135 [06:25<41:18, 20.65s/it] 12%|█▏        | 16/135 [06:45<40:34, 20.46s/it] 13%|█▎        | 17/135 [07:14<45:16, 23.02s/it] 13%|█▎        | 18/135 [07:43<48:23, 24.82s/it] 14%|█▍        | 19/135 [08:04<45:44, 23.66s/it] 15%|█▍        | 20/135 [08:24<43:28, 22.69s/it] 16%|█▌        | 21/135 [08:50<45:12, 23.79s/it] 16%|█▋        | 22/135 [09:26<51:37, 27.42s/it] 17%|█▋        | 23/135 [09:43<45:13, 24.22s/it] 18%|█▊        | 24/135 [10:02<42:04, 22.75s/it] 19%|█▊        | 25/135 [10:17<37:27, 20.44s/it] 19%|█▉        | 26/135 [10:26<30:52, 17.00s/it] 20%|██        | 27/135 [10:58<38:29, 21.39s/it] 21%|██        | 28/135 [11:24<40:24, 22.66s/it] 21%|██▏       | 29/135 [11:55<44:42, 25.30s/it] 22%|██▏       | 30/135 [12:23<45:25, 25.96s/it] 23%|██▎       | 31/135 [12:46<43:41, 25.21s/it] 24%|██▎       | 32/135 [13:07<41:17, 24.05s/it] 24%|██▍       | 33/135 [13:23<36:40, 21.57s/it] 25%|██▌       | 34/135 [13:37<32:12, 19.14s/it] 26%|██▌       | 35/135 [13:56<31:56, 19.17s/it] 27%|██▋       | 36/135 [14:21<34:38, 20.99s/it] 27%|██▋       | 37/135 [14:41<33:56, 20.78s/it] 28%|██▊       | 38/135 [14:49<27:09, 16.80s/it] 29%|██▉       | 39/135 [15:04<26:10, 16.36s/it] 30%|██▉       | 40/135 [15:41<35:44, 22.58s/it] 30%|███       | 41/135 [16:00<33:30, 21.39s/it] 31%|███       | 42/135 [17:01<51:32, 33.25s/it] 32%|███▏      | 43/135 [17:24<46:31, 30.34s/it] 33%|███▎      | 44/135 [17:42<40:20, 26.60s/it] 33%|███▎      | 45/135 [18:03<37:08, 24.76s/it] 34%|███▍      | 46/135 [18:20<33:33, 22.62s/it] 35%|███▍      | 47/135 [18:54<37:45, 25.75s/it] 36%|███▌      | 48/135 [19:37<44:50, 30.93s/it] 36%|███▋      | 49/135 [19:58<40:21, 28.16s/it] 37%|███▋      | 50/135 [20:20<37:06, 26.19s/it] 38%|███▊      | 51/135 [20:44<35:53, 25.63s/it] 39%|███▊      | 52/135 [21:35<45:52, 33.16s/it] 39%|███▉      | 53/135 [22:00<41:55, 30.68s/it] 40%|████      | 54/135 [22:12<33:48, 25.04s/it] 41%|████      | 55/135 [22:29<30:26, 22.84s/it] 41%|████▏     | 56/135 [22:41<25:35, 19.43s/it] 42%|████▏     | 57/135 [23:02<25:48, 19.86s/it] 43%|████▎     | 58/135 [23:29<28:26, 22.17s/it] 44%|████▎     | 59/135 [23:52<28:07, 22.21s/it] 44%|████▍     | 60/135 [24:06<24:46, 19.83s/it] 45%|████▌     | 61/135 [24:23<23:21, 18.93s/it] 46%|████▌     | 62/135 [24:44<23:53, 19.64s/it] 47%|████▋     | 63/135 [24:56<20:50, 17.37s/it] 47%|████▋     | 64/135 [25:18<22:03, 18.64s/it] 48%|████▊     | 65/135 [25:44<24:35, 21.08s/it] 49%|████▉     | 66/135 [26:32<33:21, 29.00s/it] 50%|████▉     | 67/135 [26:54<30:28, 26.89s/it] 50%|█████     | 68/135 [27:31<33:34, 30.07s/it] 51%|█████     | 69/135 [27:53<30:23, 27.62s/it] 52%|█████▏    | 70/135 [28:09<26:05, 24.08s/it] 53%|█████▎    | 71/135 [29:09<37:03, 34.74s/it] 53%|█████▎    | 72/135 [29:50<38:38, 36.81s/it] 54%|█████▍    | 73/135 [30:04<30:48, 29.81s/it] 55%|█████▍    | 74/135 [30:50<35:15, 34.67s/it] 56%|█████▌    | 75/135 [31:33<37:06, 37.12s/it] 56%|█████▋    | 76/135 [32:02<34:13, 34.80s/it] 57%|█████▋    | 77/135 [32:26<30:27, 31.51s/it] 58%|█████▊    | 78/135 [33:16<35:07, 36.97s/it] 59%|█████▊    | 79/135 [33:53<34:38, 37.12s/it] 59%|█████▉    | 80/135 [34:10<28:23, 30.96s/it] 60%|██████    | 81/135 [34:54<31:32, 35.04s/it] 61%|██████    | 82/135 [35:09<25:29, 28.86s/it] 61%|██████▏   | 83/135 [35:23<21:14, 24.51s/it] 62%|██████▏   | 84/135 [35:53<22:10, 26.09s/it] 63%|██████▎   | 85/135 [36:15<20:47, 24.94s/it] 64%|██████▎   | 86/135 [37:00<25:19, 31.01s/it] 64%|██████▍   | 87/135 [37:31<24:50, 31.06s/it] 65%|██████▌   | 88/135 [38:24<29:20, 37.45s/it] 66%|██████▌   | 89/135 [38:45<24:54, 32.48s/it] 67%|██████▋   | 90/135 [39:19<24:44, 32.98s/it] 67%|██████▋   | 91/135 [40:02<26:26, 36.06s/it] 68%|██████▊   | 92/135 [40:16<21:03, 29.38s/it] 69%|██████▉   | 93/135 [40:47<20:50, 29.77s/it] 70%|██████▉   | 94/135 [41:18<20:45, 30.37s/it] 70%|███████   | 95/135 [41:40<18:28, 27.70s/it] 71%|███████   | 96/135 [42:11<18:45, 28.87s/it] 72%|███████▏  | 97/135 [42:25<15:25, 24.35s/it] 73%|███████▎  | 98/135 [42:53<15:35, 25.30s/it] 73%|███████▎  | 99/135 [43:31<17:28, 29.13s/it] 74%|███████▍  | 100/135 [43:54<15:52, 27.22s/it] 75%|███████▍  | 101/135 [44:12<13:53, 24.52s/it] 76%|███████▌  | 102/135 [44:45<14:57, 27.19s/it] 76%|███████▋  | 103/135 [45:02<12:47, 23.99s/it] 77%|███████▋  | 104/135 [45:31<13:12, 25.58s/it] 78%|███████▊  | 105/135 [45:52<12:07, 24.25s/it] 79%|███████▊  | 106/135 [46:29<13:35, 28.11s/it] 79%|███████▉  | 107/135 [46:50<12:01, 25.77s/it] 80%|████████  | 108/135 [47:32<13:50, 30.77s/it] 81%|████████  | 109/135 [47:53<12:04, 27.85s/it] 81%|████████▏ | 110/135 [48:25<12:03, 28.95s/it] 82%|████████▏ | 111/135 [48:59<12:17, 30.74s/it] 83%|████████▎ | 112/135 [49:08<09:15, 24.14s/it] 84%|████████▎ | 113/135 [50:05<12:25, 33.90s/it] 84%|████████▍ | 114/135 [51:00<14:06, 40.32s/it] 85%|████████▌ | 115/135 [51:51<14:29, 43.45s/it] 86%|████████▌ | 116/135 [52:04<10:49, 34.19s/it] 87%|████████▋ | 117/135 [52:25<09:06, 30.38s/it] 87%|████████▋ | 118/135 [52:40<07:18, 25.80s/it] 88%|████████▊ | 119/135 [53:10<07:12, 27.06s/it] 89%|████████▉ | 120/135 [53:43<07:13, 28.93s/it] 90%|████████▉ | 121/135 [54:04<06:08, 26.32s/it] 90%|█████████ | 122/135 [54:28<05:34, 25.75s/it] 91%|█████████ | 123/135 [54:48<04:49, 24.09s/it] 92%|█████████▏| 124/135 [54:57<03:32, 19.35s/it] 93%|█████████▎| 125/135 [55:35<04:11, 25.16s/it] 93%|█████████▎| 126/135 [55:46<03:07, 20.87s/it] 94%|█████████▍| 127/135 [55:58<02:25, 18.20s/it] 95%|█████████▍| 128/135 [56:10<01:55, 16.46s/it] 96%|█████████▌| 129/135 [56:25<01:34, 15.80s/it] 96%|█████████▋| 130/135 [56:57<01:43, 20.63s/it] 97%|█████████▋| 131/135 [57:26<01:33, 23.30s/it] 98%|█████████▊| 132/135 [57:39<01:00, 20.26s/it] 99%|█████████▊| 133/135 [58:11<00:47, 23.68s/it] 99%|█████████▉| 134/135 [58:28<00:21, 21.77s/it]100%|██████████| 135/135 [59:47<00:00, 38.71s/it]100%|██████████| 135/135 [59:47<00:00, 26.57s/it]
Done! Made 897 calls to LLM.

=== FINAL DIAGNOSTIC PERFORMANCE (Mean Scores) ===

Saved performance summary to '../../../../results/top_5_accuracy/accuracy_metrics/memorization_experiment/summarized_resultspredicted_diagnoses_deepseek-reasoner_medical_literature_only_20260126_145408.json_diagnostic_performance_summary.csv'

Total Cases Completely Missed: 39
Example Miss:
diagnosis             Anorexia nervosa with focal cortical dysplasia
model_diagnosis    1. Anorexia Nervosa, severe - ICD-10 F50.01\n2...
Name: 1, dtype: object

Saved detailed results to '../../../../results/top_5_accuracy/accuracy_metrics/memorization_experiment/detailed_results/predicted_diagnoses_deepseek-reasoner_medical_literature_only_20260126_145408.json_diagnostic_evaluation_results_detailed.csv'
Starting evaluation for predicted_diagnoses_gemini-3-pro-preview_fictitious_only_20260126_151138.json...
  0%|          | 0/61 [00:00<?, ?it/s]  2%|▏         | 1/61 [00:17<17:36, 17.61s/it]  3%|▎         | 2/61 [00:45<23:10, 23.57s/it]  5%|▍         | 3/61 [01:03<20:36, 21.32s/it]  7%|▋         | 4/61 [01:29<21:50, 22.98s/it]  8%|▊         | 5/61 [01:54<22:13, 23.81s/it] 10%|▉         | 6/61 [02:35<27:09, 29.63s/it] 11%|█▏        | 7/61 [03:24<32:16, 35.86s/it] 13%|█▎        | 8/61 [04:32<40:43, 46.10s/it] 15%|█▍        | 9/61 [04:45<31:04, 35.86s/it] 16%|█▋        | 10/61 [05:05<26:10, 30.80s/it] 18%|█▊        | 11/61 [05:29<24:06, 28.92s/it] 20%|█▉        | 12/61 [05:58<23:31, 28.81s/it] 21%|██▏       | 13/61 [06:52<29:03, 36.32s/it] 23%|██▎       | 14/61 [07:09<24:00, 30.66s/it] 25%|██▍       | 15/61 [07:38<23:06, 30.14s/it] 26%|██▌       | 16/61 [08:43<30:21, 40.48s/it] 28%|██▊       | 17/61 [09:30<31:17, 42.66s/it] 30%|██▉       | 18/61 [10:15<30:54, 43.14s/it] 31%|███       | 19/61 [10:31<24:34, 35.12s/it] 33%|███▎      | 20/61 [11:39<30:50, 45.14s/it] 34%|███▍      | 21/61 [12:16<28:16, 42.41s/it] 36%|███▌      | 22/61 [13:05<28:59, 44.61s/it] 38%|███▊      | 23/61 [13:34<25:12, 39.80s/it] 39%|███▉      | 24/61 [14:11<24:00, 38.93s/it] 41%|████      | 25/61 [14:45<22:26, 37.41s/it] 85%|████████▌ | 52/61 [15:02<00:32,  3.58s/it] 87%|████████▋ | 53/61 [15:23<00:35,  4.39s/it] 89%|████████▊ | 54/61 [15:45<00:38,  5.46s/it] 90%|█████████ | 55/61 [16:14<00:44,  7.42s/it] 92%|█████████▏| 56/61 [16:26<00:39,  7.89s/it] 93%|█████████▎| 57/61 [16:40<00:34,  8.64s/it] 95%|█████████▌| 58/61 [17:00<00:31, 10.40s/it] 97%|█████████▋| 59/61 [17:15<00:22, 11.29s/it] 98%|█████████▊| 60/61 [17:29<00:11, 11.91s/it]100%|██████████| 61/61 [18:02<00:00, 16.69s/it]100%|██████████| 61/61 [18:02<00:00, 17.75s/it]
Done! Made 291 calls to LLM.

=== FINAL DIAGNOSTIC PERFORMANCE (Mean Scores) ===

Saved performance summary to '../../../../results/top_5_accuracy/accuracy_metrics/memorization_experiment/summarized_resultspredicted_diagnoses_gemini-3-pro-preview_fictitious_only_20260126_151138.json_diagnostic_performance_summary.csv'

Total Cases Completely Missed: 4
Example Miss:
diagnosis                      Obsessive compulsive disorder (F42.8)
model_diagnosis    1. Obsessive-compulsive disorder - F42.2\n2. G...
Name: 0, dtype: object

Saved detailed results to '../../../../results/top_5_accuracy/accuracy_metrics/memorization_experiment/detailed_results/predicted_diagnoses_gemini-3-pro-preview_fictitious_only_20260126_151138.json_diagnostic_evaluation_results_detailed.csv'
Starting evaluation for predicted_diagnoses_claude-opus-4-5-20251101_fictitious_only_20260126_201438.json...
  0%|          | 0/61 [00:00<?, ?it/s]  2%|▏         | 1/61 [00:18<18:31, 18.52s/it]  3%|▎         | 2/61 [00:47<24:21, 24.77s/it]  5%|▍         | 3/61 [01:12<24:03, 24.88s/it]  7%|▋         | 4/61 [01:26<19:39, 20.69s/it]  8%|▊         | 5/61 [01:54<21:27, 22.99s/it] 10%|▉         | 6/61 [02:37<27:24, 29.90s/it] 11%|█▏        | 7/61 [03:21<31:04, 34.53s/it] 13%|█▎        | 8/61 [04:15<36:08, 40.92s/it] 15%|█▍        | 9/61 [04:29<27:59, 32.30s/it] 16%|█▋        | 10/61 [04:50<24:28, 28.79s/it] 18%|█▊        | 11/61 [05:11<21:58, 26.37s/it] 20%|█▉        | 12/61 [05:36<21:10, 25.93s/it] 21%|██▏       | 13/61 [06:24<26:09, 32.71s/it] 23%|██▎       | 14/61 [06:43<22:19, 28.50s/it] 25%|██▍       | 15/61 [07:07<20:47, 27.12s/it] 26%|██▌       | 16/61 [07:59<26:08, 34.85s/it] 28%|██▊       | 17/61 [08:45<27:51, 37.99s/it] 30%|██▉       | 18/61 [09:47<32:23, 45.20s/it] 31%|███       | 19/61 [10:02<25:21, 36.22s/it] 33%|███▎      | 20/61 [11:10<31:14, 45.71s/it] 34%|███▍      | 21/61 [11:50<29:17, 43.95s/it] 36%|███▌      | 22/61 [12:40<29:46, 45.81s/it] 38%|███▊      | 23/61 [13:15<26:54, 42.49s/it] 39%|███▉      | 24/61 [13:45<23:56, 38.83s/it] 41%|████      | 25/61 [14:16<22:00, 36.68s/it] 85%|████████▌ | 52/61 [14:36<00:32,  3.58s/it] 87%|████████▋ | 53/61 [14:55<00:34,  4.30s/it] 89%|████████▊ | 54/61 [15:16<00:37,  5.36s/it] 90%|█████████ | 55/61 [15:47<00:44,  7.39s/it] 92%|█████████▏| 56/61 [16:02<00:41,  8.23s/it] 93%|█████████▎| 57/61 [16:15<00:35,  8.80s/it] 95%|█████████▌| 58/61 [16:39<00:33, 11.16s/it] 97%|█████████▋| 59/61 [16:56<00:24, 12.33s/it] 98%|█████████▊| 60/61 [17:06<00:11, 11.88s/it]100%|██████████| 61/61 [17:37<00:00, 16.11s/it]100%|██████████| 61/61 [17:37<00:00, 17.33s/it]
Done! Made 288 calls to LLM.

=== FINAL DIAGNOSTIC PERFORMANCE (Mean Scores) ===

Saved performance summary to '../../../../results/top_5_accuracy/accuracy_metrics/memorization_experiment/summarized_resultspredicted_diagnoses_claude-opus-4-5-20251101_fictitious_only_20260126_201438.json_diagnostic_performance_summary.csv'

Total Cases Completely Missed: 4
Example Miss:
diagnosis                      Obsessive compulsive disorder (F42.8)
model_diagnosis    1. Obsessive-Compulsive Disorder - F42.2\n2. G...
Name: 0, dtype: object

Saved detailed results to '../../../../results/top_5_accuracy/accuracy_metrics/memorization_experiment/detailed_results/predicted_diagnoses_claude-opus-4-5-20251101_fictitious_only_20260126_201438.json_diagnostic_evaluation_results_detailed.csv'
Starting evaluation for predicted_diagnoses_gpt-5.2_medical_literature_only_20260127_013541.json...
  0%|          | 0/135 [00:00<?, ?it/s]  1%|          | 1/135 [00:17<39:31, 17.69s/it]  1%|▏         | 2/135 [00:40<45:41, 20.62s/it]  2%|▏         | 3/135 [00:53<37:30, 17.05s/it]  3%|▎         | 4/135 [01:08<35:42, 16.36s/it]  4%|▎         | 5/135 [01:25<35:36, 16.44s/it]  4%|▍         | 6/135 [01:41<35:43, 16.61s/it]  5%|▌         | 7/135 [01:45<26:04, 12.22s/it]  6%|▌         | 8/135 [02:36<52:23, 24.75s/it]  7%|▋         | 9/135 [03:03<53:00, 25.24s/it]  7%|▋         | 10/135 [03:23<49:12, 23.62s/it]  8%|▊         | 11/135 [03:46<48:29, 23.46s/it]  9%|▉         | 12/135 [04:13<50:13, 24.50s/it] 10%|▉         | 13/135 [04:35<48:25, 23.82s/it] 10%|█         | 14/135 [04:45<39:55, 19.79s/it] 11%|█         | 15/135 [05:01<36:53, 18.45s/it] 12%|█▏        | 16/135 [05:20<36:53, 18.60s/it] 13%|█▎        | 17/135 [05:39<36:58, 18.80s/it] 13%|█▎        | 18/135 [06:00<38:00, 19.49s/it] 14%|█▍        | 19/135 [06:26<41:38, 21.54s/it] 15%|█▍        | 20/135 [06:49<42:07, 21.98s/it] 16%|█▌        | 21/135 [07:23<48:27, 25.50s/it] 16%|█▋        | 22/135 [07:55<51:51, 27.53s/it] 17%|█▋        | 23/135 [08:09<43:57, 23.55s/it] 18%|█▊        | 24/135 [08:36<45:25, 24.55s/it] 19%|█▊        | 25/135 [08:54<41:19, 22.54s/it] 19%|█▉        | 26/135 [09:04<34:00, 18.72s/it] 20%|██        | 27/135 [09:28<36:21, 20.20s/it] 21%|██        | 28/135 [09:45<34:33, 19.38s/it] 21%|██▏       | 29/135 [10:14<39:12, 22.19s/it] 22%|██▏       | 30/135 [10:45<43:32, 24.88s/it] 23%|██▎       | 31/135 [11:02<39:01, 22.52s/it] 24%|██▎       | 32/135 [11:19<35:47, 20.85s/it] 24%|██▍       | 33/135 [11:35<32:54, 19.36s/it] 25%|██▌       | 34/135 [11:47<28:47, 17.11s/it] 26%|██▌       | 35/135 [12:07<30:02, 18.02s/it] 27%|██▋       | 36/135 [12:31<32:44, 19.84s/it] 27%|██▋       | 37/135 [12:55<34:23, 21.06s/it] 28%|██▊       | 38/135 [13:08<30:11, 18.67s/it] 29%|██▉       | 39/135 [13:28<30:35, 19.12s/it] 30%|██▉       | 40/135 [14:07<39:38, 25.04s/it] 30%|███       | 41/135 [14:28<37:06, 23.69s/it] 31%|███       | 42/135 [15:44<1:01:12, 39.49s/it] 32%|███▏      | 43/135 [16:10<54:25, 35.50s/it]   33%|███▎      | 44/135 [16:43<52:50, 34.84s/it] 33%|███▎      | 45/135 [17:04<45:59, 30.66s/it] 34%|███▍      | 46/135 [17:27<41:47, 28.17s/it] 35%|███▍      | 47/135 [18:02<44:40, 30.46s/it] 36%|███▌      | 48/135 [18:52<52:26, 36.16s/it] 36%|███▋      | 49/135 [19:06<42:19, 29.53s/it] 37%|███▋      | 50/135 [19:18<34:27, 24.32s/it] 38%|███▊      | 51/135 [19:36<31:27, 22.47s/it] 39%|███▊      | 52/135 [20:09<35:30, 25.67s/it] 39%|███▉      | 53/135 [20:25<31:06, 22.76s/it] 40%|████      | 54/135 [20:39<26:56, 19.95s/it] 41%|████      | 55/135 [20:59<26:49, 20.12s/it] 41%|████▏     | 56/135 [21:14<24:26, 18.57s/it] 42%|████▏     | 57/135 [21:47<29:40, 22.83s/it] 43%|████▎     | 58/135 [22:38<39:59, 31.17s/it] 44%|████▎     | 59/135 [23:01<36:35, 28.88s/it] 44%|████▍     | 60/135 [23:16<30:47, 24.64s/it] 45%|████▌     | 61/135 [23:32<27:14, 22.08s/it] 46%|████▌     | 62/135 [23:53<26:21, 21.67s/it] 47%|████▋     | 63/135 [24:09<23:57, 19.96s/it] 47%|████▋     | 64/135 [24:34<25:23, 21.46s/it] 48%|████▊     | 65/135 [25:10<30:07, 25.83s/it] 49%|████▉     | 66/135 [25:44<32:47, 28.51s/it] 50%|████▉     | 67/135 [26:08<30:28, 26.90s/it] 50%|█████     | 68/135 [26:32<29:17, 26.23s/it] 51%|█████     | 69/135 [26:53<27:01, 24.57s/it] 52%|█████▏    | 70/135 [27:06<22:41, 20.95s/it] 53%|█████▎    | 71/135 [27:59<32:42, 30.66s/it] 53%|█████▎    | 72/135 [28:27<31:29, 30.00s/it] 54%|█████▍    | 73/135 [28:39<25:28, 24.65s/it] 55%|█████▍    | 74/135 [29:14<28:00, 27.55s/it] 56%|█████▌    | 75/135 [29:40<27:08, 27.14s/it] 56%|█████▋    | 76/135 [30:01<24:46, 25.19s/it] 57%|█████▋    | 77/135 [30:18<22:13, 22.99s/it] 58%|█████▊    | 78/135 [30:46<23:16, 24.50s/it] 59%|█████▊    | 79/135 [31:24<26:24, 28.30s/it] 59%|█████▉    | 80/135 [31:36<21:33, 23.52s/it] 60%|██████    | 81/135 [32:17<25:49, 28.69s/it] 61%|██████    | 82/135 [32:32<21:53, 24.79s/it] 61%|██████▏   | 83/135 [32:46<18:29, 21.33s/it] 62%|██████▏   | 84/135 [33:07<18:14, 21.46s/it] 63%|██████▎   | 85/135 [33:23<16:31, 19.82s/it] 64%|██████▎   | 86/135 [34:02<20:45, 25.42s/it] 64%|██████▍   | 87/135 [34:24<19:27, 24.33s/it] 65%|██████▌   | 88/135 [35:04<22:51, 29.18s/it] 66%|██████▌   | 89/135 [35:15<18:14, 23.80s/it] 67%|██████▋   | 90/135 [36:00<22:30, 30.01s/it] 67%|██████▋   | 91/135 [36:55<27:37, 37.66s/it] 68%|██████▊   | 92/135 [37:07<21:28, 29.97s/it] 69%|██████▉   | 93/135 [37:40<21:24, 30.58s/it] 70%|██████▉   | 94/135 [37:58<18:31, 27.10s/it] 70%|███████   | 95/135 [38:21<17:11, 25.80s/it] 71%|███████   | 96/135 [38:56<18:32, 28.53s/it] 72%|███████▏  | 97/135 [39:12<15:40, 24.76s/it] 73%|███████▎  | 98/135 [39:40<15:52, 25.75s/it] 73%|███████▎  | 99/135 [40:05<15:17, 25.49s/it] 74%|███████▍  | 100/135 [40:15<12:10, 20.86s/it] 75%|███████▍  | 101/135 [40:28<10:29, 18.50s/it] 76%|███████▌  | 102/135 [40:56<11:43, 21.31s/it] 76%|███████▋  | 103/135 [41:10<10:14, 19.21s/it] 77%|███████▋  | 104/135 [41:37<11:06, 21.50s/it] 78%|███████▊  | 105/135 [41:51<09:32, 19.08s/it] 79%|███████▊  | 106/135 [42:29<12:04, 25.00s/it] 79%|███████▉  | 107/135 [42:48<10:46, 23.10s/it] 80%|████████  | 108/135 [43:24<12:06, 26.92s/it] 81%|████████  | 109/135 [43:46<11:03, 25.52s/it] 81%|████████▏ | 110/135 [44:18<11:24, 27.40s/it] 82%|████████▏ | 111/135 [44:59<12:38, 31.62s/it] 83%|████████▎ | 112/135 [45:10<09:45, 25.44s/it] 84%|████████▎ | 113/135 [45:55<11:25, 31.14s/it] 84%|████████▍ | 114/135 [46:31<11:25, 32.65s/it] 85%|████████▌ | 115/135 [47:06<11:04, 33.22s/it] 86%|████████▌ | 116/135 [47:16<08:23, 26.49s/it] 87%|████████▋ | 117/135 [47:43<08:00, 26.69s/it] 87%|████████▋ | 118/135 [47:55<06:14, 22.03s/it] 88%|████████▊ | 119/135 [48:25<06:30, 24.39s/it] 89%|████████▉ | 120/135 [49:02<07:06, 28.43s/it] 90%|████████▉ | 121/135 [49:19<05:50, 25.01s/it] 90%|█████████ | 122/135 [49:41<05:11, 23.99s/it] 91%|█████████ | 123/135 [50:03<04:40, 23.40s/it] 92%|█████████▏| 124/135 [50:19<03:51, 21.03s/it] 93%|█████████▎| 125/135 [50:46<03:50, 23.01s/it] 93%|█████████▎| 126/135 [51:00<03:01, 20.20s/it] 94%|█████████▍| 127/135 [51:11<02:19, 17.38s/it] 95%|█████████▍| 128/135 [51:23<01:51, 15.86s/it] 96%|█████████▌| 129/135 [51:33<01:25, 14.19s/it] 96%|█████████▋| 130/135 [52:06<01:38, 19.64s/it] 97%|█████████▋| 131/135 [52:42<01:38, 24.58s/it] 98%|█████████▊| 132/135 [52:57<01:04, 21.66s/it] 99%|█████████▊| 133/135 [53:45<00:59, 29.66s/it] 99%|█████████▉| 134/135 [53:59<00:25, 25.08s/it]100%|██████████| 135/135 [55:15<00:00, 40.14s/it]100%|██████████| 135/135 [55:15<00:00, 24.56s/it]
Done! Made 875 calls to LLM.

=== FINAL DIAGNOSTIC PERFORMANCE (Mean Scores) ===

Saved performance summary to '../../../../results/top_5_accuracy/accuracy_metrics/memorization_experiment/summarized_resultspredicted_diagnoses_gpt-5.2_medical_literature_only_20260127_013541.json_diagnostic_performance_summary.csv'

Total Cases Completely Missed: 32
Example Miss:
diagnosis             Anorexia nervosa with focal cortical dysplasia
model_diagnosis    1. Anorexia nervosa, restricting type - F50.01...
Name: 1, dtype: object

Saved detailed results to '../../../../results/top_5_accuracy/accuracy_metrics/memorization_experiment/detailed_results/predicted_diagnoses_gpt-5.2_medical_literature_only_20260127_013541.json_diagnostic_evaluation_results_detailed.csv'
Starting evaluation for predicted_diagnoses_gpt-5.2_fictitious_only_20260126_180947.json...
  0%|          | 0/61 [00:00<?, ?it/s]  2%|▏         | 1/61 [00:15<15:45, 15.76s/it]  3%|▎         | 2/61 [00:38<19:31, 19.86s/it]  5%|▍         | 3/61 [00:56<18:16, 18.90s/it]  7%|▋         | 4/61 [01:12<16:55, 17.82s/it]  8%|▊         | 5/61 [01:41<20:29, 21.95s/it] 10%|▉         | 6/61 [02:30<28:25, 31.02s/it] 11%|█▏        | 7/61 [03:05<29:11, 32.43s/it] 13%|█▎        | 8/61 [04:17<39:38, 44.88s/it] 15%|█▍        | 9/61 [04:32<30:52, 35.62s/it] 16%|█▋        | 10/61 [04:57<27:31, 32.38s/it] 18%|█▊        | 11/61 [05:27<26:18, 31.56s/it] 20%|█▉        | 12/61 [06:03<26:59, 33.04s/it] 21%|██▏       | 13/61 [07:05<33:26, 41.79s/it] 23%|██▎       | 14/61 [07:35<29:56, 38.23s/it] 25%|██▍       | 15/61 [08:06<27:39, 36.07s/it] 26%|██▌       | 16/61 [09:13<34:04, 45.44s/it] 28%|██▊       | 17/61 [10:00<33:32, 45.74s/it] 30%|██▉       | 18/61 [10:58<35:26, 49.44s/it] 31%|███       | 19/61 [11:12<27:10, 38.83s/it] 33%|███▎      | 20/61 [12:30<34:35, 50.62s/it] 34%|███▍      | 21/61 [13:02<29:58, 44.97s/it] 36%|███▌      | 22/61 [13:54<30:38, 47.14s/it] 38%|███▊      | 23/61 [14:26<27:02, 42.69s/it] 39%|███▉      | 24/61 [14:58<24:15, 39.34s/it] 41%|████      | 25/61 [15:37<23:34, 39.28s/it] 85%|████████▌ | 52/61 [15:55<00:33,  3.72s/it] 87%|████████▋ | 53/61 [16:11<00:34,  4.33s/it] 89%|████████▊ | 54/61 [16:42<00:41,  5.97s/it] 90%|█████████ | 55/61 [17:17<00:50,  8.35s/it] 92%|█████████▏| 56/61 [17:34<00:46,  9.22s/it] 93%|█████████▎| 57/61 [17:48<00:39,  9.87s/it] 95%|█████████▌| 58/61 [18:09<00:34, 11.52s/it] 97%|█████████▋| 59/61 [18:23<00:24, 12.02s/it] 98%|█████████▊| 60/61 [18:37<00:12, 12.54s/it]100%|██████████| 61/61 [19:00<00:00, 14.94s/it]100%|██████████| 61/61 [19:00<00:00, 18.70s/it]
Done! Made 293 calls to LLM.

=== FINAL DIAGNOSTIC PERFORMANCE (Mean Scores) ===

Saved performance summary to '../../../../results/top_5_accuracy/accuracy_metrics/memorization_experiment/summarized_resultspredicted_diagnoses_gpt-5.2_fictitious_only_20260126_180947.json_diagnostic_performance_summary.csv'

Total Cases Completely Missed: 6
Example Miss:
diagnosis          Bipolar disorder, most recent episode manic, i...
model_diagnosis    1. Alcohol use disorder, moderate to severe - ...
Name: 1, dtype: object

Saved detailed results to '../../../../results/top_5_accuracy/accuracy_metrics/memorization_experiment/detailed_results/predicted_diagnoses_gpt-5.2_fictitious_only_20260126_180947.json_diagnostic_evaluation_results_detailed.csv'
